{
  "version": "v1",
  "created_at": "2025-12-07T00:00:00Z",
  "description": "Example rows for the HPS DealEngine Negotiation Strategy Matrix",
  "rows": [
    {
      "id": "competence_foreclosure_heavy_repairs_emergency",
      "module": "competence",
      "scenario_label": "In-foreclosure, heavy repairs, auction inside 14 days",
      "deal_facts": {
        "condition_band": "heavy",
        "repairs_band": "high",
        "repair_evidence": "estimator_only",
        "has_big5_issues": true,
        "status_in_foreclosure": true,
        "seller_motivation_primary": "avoid_auction",
        "motivation_strength": "high",
        "timeline_urgency": "emergency",
        "timeline_trigger": "auction",
        "arrears_band": "critical",
        "shortfall_vs_payoff_band": "shortfall",
        "zip_speed_band": "fast",
        "market_temp_label": "hot",
        "confidence_grade": "B",
        "risk_flags": ["uninsurable"],
        "lead_channel": "inbound_call",
        "trust_level": "lukewarm"
      },
      "preemptive_objection": "offer_too_low_vs_what_i_owe",
      "trigger_timing": "before_any_numbers",
      "competence_focus": "repairs",
      "ackerman_stage": null,
      "pivot_focus": null,
      "motivation_context": null,
      "trigger_phrase": "Before we even talk about a number, can I walk you through what the data is saying about this property?",
      "script_body": "On the repair side, the scope is coming back heavy between the roof, systems, and interior. On top of that, the payoff letter shows arrears and daily interest still climbing while the auction clock is running. When we plug those into our underwriting engine, it forces us to be conservative so we don’t promise you something we can’t actually close on.",
      "cushioning_statement": null,
      "followup_question": "Does that line up with what you’ve been dealing with on your side?",
      "notes_for_ai": "Deliver in a calm, audit-style tone. Do not mention specific dollar amounts here; those will be filled in separately if needed."
    },
    {
      "id": "price_anchor_tired_landlord_medium_repairs_neutral_market",
      "module": "price_anchor",
      "scenario_label": "Tired landlord, medium repairs, neutral ZIP",
      "deal_facts": {
        "condition_band": "medium",
        "repairs_band": "medium",
        "repair_evidence": "bids_present",
        "has_big5_issues": false,
        "status_in_foreclosure": false,
        "seller_motivation_primary": "tired_landlord",
        "motivation_strength": "medium",
        "timeline_urgency": "high",
        "timeline_trigger": "move_date",
        "arrears_band": "moderate",
        "shortfall_vs_payoff_band": "thin",
        "zip_speed_band": "neutral",
        "market_temp_label": "neutral",
        "confidence_grade": "A",
        "risk_flags": [],
        "lead_channel": "ppc",
        "trust_level": "cold"
      },
      "preemptive_objection": "offer_too_low_vs_zillow",
      "trigger_timing": "before_first_offer",
      "competence_focus": null,
      "ackerman_stage": "first_number",
      "pivot_focus": null,
      "motivation_context": null,
      "trigger_phrase": "Let me show you how the numbers come together before I tell you where we can land.",
      "script_body": "Your after-repair value in this ZIP, based on recent sales, is around {arv}. From there we back out the actual bids on repairs, the holding costs while it is vacant, and the fees we eat on resale. That leaves a buyer ceiling around {buyer_ceiling} where an investor can still make the project work. Our offer has to sit below that ceiling so we can actually close and take on the risk.",
      "cushioning_statement": "With all of that in mind, here is the figure our underwriting engine can realistically support.",
      "followup_question": "Before I share the exact number, does that math flow make sense so far?",
      "notes_for_ai": "Use {arv} and {buyer_ceiling} placeholders only; do not fabricate numbers. Tone: matter-of-fact, not apologetic."
    },
    {
      "id": "negative_reverse_low_motivation_equity_landlord_slow_zip",
      "module": "negative_reverse",
      "scenario_label": "Equity landlord, slow market, low motivation",
      "deal_facts": {
        "condition_band": "light",
        "repairs_band": "low",
        "repair_evidence": "none",
        "has_big5_issues": false,
        "status_in_foreclosure": false,
        "seller_motivation_primary": "equity_cash_out",
        "motivation_strength": "low",
        "timeline_urgency": "low",
        "timeline_trigger": "none",
        "arrears_band": "none",
        "shortfall_vs_payoff_band": "big_cushion",
        "zip_speed_band": "slow",
        "market_temp_label": "cool",
        "confidence_grade": "B",
        "risk_flags": [],
        "lead_channel": "referral",
        "trust_level": "warm"
      },
      "preemptive_objection": "i_dont_need_to_sell",
      "trigger_timing": "after_low_engagement_signals",
      "competence_focus": null,
      "ackerman_stage": null,
      "pivot_focus": null,
      "motivation_context": "Plenty of equity; pain is low but headaches will continue.",
      "trigger_phrase": "I might be reading this wrong, but it doesn’t sound like you absolutely need to sell this right now.",
      "script_body": "Honestly, you could keep the place and ride it out, especially with the equity you have. The trade-off is staying on the hook for the maintenance calls, vacancies, and the slower market in this ZIP. Sometimes the best move is to hold, and sometimes it is to cash out and put that equity into something less hands-on.",
      "cushioning_statement": null,
      "followup_question": "If you did nothing and just kept it another year, what feels like the upside and what worries you about that path?",
      "notes_for_ai": "Be completely non-attached to the outcome. This is a motivation test, not a hard close."
    },
    {
      "id": "objection_pivot_zillow_vs_heavy_repairs_slow_market",
      "module": "objection_pivot",
      "scenario_label": "Seller anchored to online value, heavy repairs, slow market",
      "deal_facts": {
        "condition_band": "heavy",
        "repairs_band": "high",
        "repair_evidence": "bids_present",
        "has_big5_issues": true,
        "status_in_foreclosure": false,
        "seller_motivation_primary": "equity_cash_out",
        "motivation_strength": "medium",
        "timeline_urgency": "high",
        "timeline_trigger": "move_date",
        "arrears_band": "low",
        "shortfall_vs_payoff_band": "big_cushion",
        "zip_speed_band": "slow",
        "market_temp_label": "cool",
        "confidence_grade": "B",
        "risk_flags": [],
        "lead_channel": "web_form",
        "trust_level": "cold"
      },
      "preemptive_objection": "offer_too_low_vs_zillow",
      "trigger_timing": "after_competence_frame_before_offer",
      "competence_focus": null,
      "ackerman_stage": null,
      "pivot_focus": "repairs",
      "motivation_context": null,
      "trigger_phrase": "Most owners who have looked at the online estimates are worried that anything below that number will feel like a lowball.",
      "script_body": "Those online numbers usually assume the house is closer to retail condition. In your case, the bids we have for the roof and interior work are significant, and the sales in this ZIP are taking longer than average. When we layer those repairs and the slower market into the underwriting, it naturally pulls the real investor number below what a website might show on a perfect, updated home.",
      "cushioning_statement": null,
      "followup_question": "Given all of that, what feels more important to you right now: squeezing every last dollar out, or getting a clean, certain exit?",
      "notes_for_ai": "Name the online-estimate concern up front, then pivot to repairs and market speed. Keep tone empathetic but firm."
    }
  ]
}
